{
  "api_version": "cyber-eval.openai/v1",
  "kind": "Approval",
  "metadata": {
    "id": "apr_synthetic-001",
    "created_at": "2026-07-23T00:30:00Z",
    "expires_at": "2026-07-23T01:30:00Z"
  },
  "spec": {
    "engagement_id": "eng_synthetic-web-001",
    "scope_generation": 1,
    "policy_digest": "sha256:1111111111111111111111111111111111111111111111111111111111111111",
    "requester_id": "usr_requester-001",
    "action": "exploit_validation",
    "target_id": "tgt_web-app-001",
    "tool_id": "tool_web-safe-001",
    "test_case_id": "tc_web-safe-001",
    "parameter_digest": "sha256:2222222222222222222222222222222222222222222222222222222222222222",
    "risk": "critical",
    "state": "approved",
    "required_approvers": 2,
    "max_uses": 1,
    "decisions": [
      {
        "approver_id": "usr_approver-001",
        "decision": "approved",
        "decided_at": "2026-07-23T00:35:00Z"
      },
      {
        "approver_id": "usr_approver-002",
        "decision": "approved",
        "decided_at": "2026-07-23T00:36:00Z"
      }
    ]
  },
  "signature": {
    "format": "dsse",
    "algorithm": "Ed25519",
    "key_id": "key_example-approval-001",
    "payload_digest": "sha256:3333333333333333333333333333333333333333333333333333333333333333",
    "value": "AAAAAAAAAAAAAAAAAAAAAAAAAAAAAAAAAAAAAAAAAAAAAAAAAAAAAAAAAAAAAAAAAAAAAAAAAAAAAAAAAAAAAA=="
  }
}
